Self_Regulation_Technique_Name,Time_Required (min),Self_Regulation_Category,Description,Instructions,
Task Migration,Variable,Executive Function/Flexibility,"Moving tasks to a different time, place, or method when the original approach isn't working, without guilt.","If you can't focus on writing at your desk, try dictating into your phone while walking, or move to a coffee shop if that helps your focus.",
Comfort Reading/Listening,Variable,Decompression/Emotional Regulation,"Engaging with familiar, low-stress books, audiobooks, or podcasts purely for comfort and relaxation, not for learning or productivity.","Re-read a favorite book, listen to a familiar audiobook you know by heart, or put on a podcast that is soothing rather than stimulating.",
The 'Buffer Time' Rule,Variable,Time Management/Transitions,"Adding extra, unplanned time between scheduled activities to allow for unexpected delays or necessary decompression.","If one meeting ends at 11:00 AM and the next starts at 11:30 AM, mentally schedule the second at 11:45 AM to give yourself a buffer.",
Object Permanence Reminders,1,Memory/Executive Function,"Using physical objects or visual reminders to compensate for challenges with object permanence (out of sight, out of mind).","Leave frequently used items (e.g., wallet, keys) in visible, designated spots rather than tucked away in drawers. Use clear containers for storage.",
Planned Escapes (Social),45779,Social Energy Management/Boundaries,Having a pre-determined exit strategy for social situations when you anticipate or experience overwhelm.,"Before a party, decide you'll stay for a specific amount of time, or identify a quiet spot you can retreat to, or have an excuse ready to leave.",
The 'Sensory Safe' Outfit,1,Sensory Comfort/Routine,"Identifying and regularly wearing a specific outfit or type of clothing that provides consistent, comfortable sensory input.","Have one or more ""go-to"" outfits that always feel right (e.g., specific fabric, loose fit, no tags) to reduce daily sensory overwhelm from clothing.",
Hyperfocus 'Scheduling',Variable,Productivity/Leveraging Strengths,"Deliberately blocking out time for activities that often trigger hyperfocus, turning it into a productive asset.","If you know you can hyperfocus on coding or a creative project, schedule dedicated, uninterrupted blocks for it, rather than trying to force other tasks during that time.",
The 'Minimal Prep' Meal Strategy,Variable,Energy Management/Executive Function,"Stocking up on and relying heavily on meals that require minimal cooking, dishes, or mental effort.","Keep a supply of microwaveable meals, pre-cut vegetables, or ingredients for very simple one-pan dishes for days when executive function is low.",
Weighted Compression Vests/Clothing,Variable,Sensory Regulation/Calming,"Wearing specialized clothing that provides consistent, gentle pressure across the torso for calming and grounding.","Explore sensory compression vests or fitted athletic wear that offers comforting deep pressure, often worn discreetly under regular clothes.",
Special Interest as De-stressor,30-120,Emotional Regulation/Recharge,"Using a special interest as a primary, intentional method for de-stressing and emotional regulation after a difficult day.","Immediately after a stressful event, dedicate time to engaging deeply with your special interest (e.g., researching a topic, working on a collection, deep-diving into a game).",
The 'Walk Away' Technique,45778,Overwhelm Reduction/Emotional Reg.,Physically removing yourself from an overwhelming situation to prevent escalation of sensory overload or emotional dysregulation.,"If a place becomes too noisy or a conversation too intense, physically leave the area for a few minutes to regain composure.",
Body Scan (Sensory Focus),10-20,Mindfulness/Sensory Awareness,A variation of body scan focusing specifically on identifying and understanding different sensory inputs throughout the body.,"Lie down and systematically bring awareness to each part of your body, noticing not just tension, but how different textures, temperatures, or pressure feel.",
The 'One Item at a Time' Cleanup,Variable,Overwhelm Reduction/Task Initiation,"When a space is overwhelming, commit to only putting away or dealing with one single item at a time.","Instead of looking at a messy room, just pick up one piece of trash, or put one item back in its place, then repeat.",
Visual Schedule/Picture Calendar,45935,Executive Function/Routine,Using a calendar with pictures or simplified visual representations for daily activities and routines.,"Create a daily or weekly schedule using drawings, symbols, or photos for each activity, especially helpful for managing transitions.",
Task 'Chunking' by Location,Variable,Productivity/Executive Function,Grouping tasks by physical location to reduce context switching and unnecessary movement.,"Instead of doing one kitchen chore, then a bedroom chore, then back to the kitchen, tackle all kitchen chores at once before moving to another room.",
The 'Sensory Reset' Station,Variable,Sensory Regulation/Proactive,"Creating a small, dedicated spot within your home with specific tools for quick sensory recalibration.","This might include a comfortable pillow, a favorite fidget toy, a small bottle of a calming essential oil, and a pair of earplugs.",
The 'Brain to Page' Dump (Structured),45935,Cognitive Management/Planning,"A more structured brain dump where ideas are quickly categorized or bulleted as they come out, for easier processing later.","Use a notebook with pre-drawn sections (e.g., ""To Do,"" ""Thoughts,"" ""Ideas,"" ""Worries"") to quickly sort information as you dump it from your mind.",
"The ""Weighted Eye Mask""",5-30,Sensory Regulation/Sleep Aid,"Using a weighted eye mask to provide gentle pressure on the eyes, aiding in relaxation, reducing light sensitivity, and promoting sleep.","Place a weighted eye mask over your eyes when resting, meditating, or trying to fall asleep to experience calming deep pressure.",
Task Pairing (Dreaded + Enjoyed),Variable,Motivation/Productivity,Pairing a highly disliked or difficult task with a genuinely enjoyable or stimulating activity.,"Only allow yourself to listen to your favorite podcast while doing the dishes, or only watch a specific show while folding laundry.",
Pre-emptive Problem Solving,45935,Executive Function/Anxiety,Anticipating potential difficulties or triggers in advance and creating a plan to address them before they occur.,"Before a new social event, mentally rehearse possible scenarios and how you'll respond, or identify potential sensory triggers and how you'll mitigate them.",
The 'Mental Vacation' Mini-Break,45689,Decompression/Cognitive Mgmt,"Briefly mentally transporting yourself to a pleasant, imaginary place to de-stress and clear your mind.","Close your eyes for 1-2 minutes and vividly imagine yourself in a favorite peaceful place (e.g., a quiet beach, a cozy cabin).",
Sensory-Specific Hydration,Variable,Sensory Regulation/Well-being,"Using specific temperatures or textures of drinks for regulation (e.g., very cold water, warm tea, fizzy drinks).","Keep ice-cold water readily available for alertness, or a comforting warm beverage for relaxation, depending on your sensory need.",
Visual Reminder Alarms,1,Executive Function/Memory,"Setting alarms on your phone with specific, descriptive labels or images to prompt tasks, not just times.","Set an alarm that says ""Pack Lunch"" or ""Take Meds"" rather than just a time, to provide immediate context for the action.",
The 'Micro-Declutter' Strategy,45935,Overwhelm Reduction/Environment,"Focusing on tidying only one very small, specific area at a time (e.g., one shelf, one drawer) when feeling overwhelmed by mess.","Instead of ""clean the room,"" choose ""clear off this one corner of the desk"" or ""organize this one section of the bookshelf.""",
Low-Demand Social Scripts,Variable,Social Communication/Energy Mgmt,"Having pre-prepared, low-energy ways to engage socially without extensive conversation or masking.","For group gatherings, identify easy conversation topics (e.g., the food, a recent movie). Have simple questions ready (""How's your week been?"").",
The 'Sensory Scavenger Hunt',45779,Grounding/Mindfulness,Deliberately seeking out specific sensory inputs in your immediate environment to ground yourself.,"When feeling overwhelmed, actively look for ""something red,"" ""something soft,"" ""something that smells good,"" etc., to bring your focus to the present.",
Routine Customization,Variable,Routine Management/Flexibility,"Adjusting existing routines to better fit your natural energy fluctuations and preferences, rather than forcing a rigid schedule.","If you're a night owl, shift non-essential morning tasks to the evening. If you dread a specific step, find a way to make it more palatable or delegate.",
Interest-Based Productivity Tools,Variable,Productivity/Motivation,"Using apps, planners, or systems that are designed around your specific interests or aesthetics to make productivity more engaging.","Find a task management app with a theme you love, or a physical planner with designs that genuinely excite you, to increase engagement.",
The 'Noise Cancelling' Habit,1,Sensory Regulation/Environment,Making it a routine to utilize noise-canceling technology in environments that are typically overwhelming.,"Get into the habit of putting on noise-canceling headphones (even without music) when entering a busy office, public transport, or a noisy cafe.",
Emotional Contagion Shielding,Variable,Emotional Regulation/Boundaries,Consciously protecting yourself from absorbing others' strong negative emotions.,"If someone is highly stressed or angry, create mental boundaries. Remind yourself their emotions are theirs, not yours, and limit exposure if possible.",
The 'Default Outfit',1,Decision Fatigue/Sensory Comfort,"Having a small selection of highly comfortable, sensory-friendly outfits that require no thought for daily wear.","Curate 2-3 comfortable outfits that always feel good and fit well, and rotate them throughout the week to eliminate clothing decision fatigue.",
Special Interest as Safe Space,Variable,Emotional Regulation/Recharge,Using your special interest as a reliable mental and emotional refuge during times of stress or overwhelm.,"When feeling burnt out or dysregulated, retreat into your special interest – watch documentaries, read articles, organize your collection, without external pressure.",
Task 'Micro-Looping',Variable,Focus/Task Completion,"Breaking a repetitive task into tiny, self-contained loops with built-in mini-rewards to maintain focus.","For laundry, the loop is: ""Pick up one item, fold it, place it in pile, then take a deep breath."" Repeat.",
The 'Brain to Text' Dump,45779,Cognitive Management/Memory,"Rapidly typing or voice-to-texting overwhelming thoughts, ideas, or to-dos into a digital document.","Use a notes app, a blank document, or a voice recorder to quickly capture everything in your head, then save it for later review.",
The 'Sensory Scan' Before Entry,1,Proactive Sensory Regulation,Quickly assessing the sensory environment of a new place before fully entering to anticipate potential overwhelm.,"Before walking into a noisy restaurant or bright store, pause at the entrance to gauge the light, sound, and smell levels.",
Flexible Planning (with Backup Plans),45935,Executive Function/Adaptability,Creating plans with built-in flexibility and having clear backup options for when things don't go as expected.,"Plan your day, but also have ""Plan B"" options for key tasks if your energy or focus shifts unexpectedly. ""If I can't do X, I will do Y instead.""",
The 'Rejection Sensitivity' Shield,45779,Emotional Regulation/Self-Compassion,Developing internal scripts or strategies to manage intense emotional reactions to perceived criticism or rejection.,"When you feel the sting of perceived rejection, remind yourself: ""This is my rejection sensitivity acting up. What is the objective reality? Is this really a personal attack, or something else?""",
"The ""Stim Toy Rotation""",Variable,Sensory Regulation/Engagement,Having a variety of fidget or stim toys and rotating them regularly to maintain novelty and effectiveness.,Keep a few different types of stim toys. Rotate which ones you use daily or weekly to keep them interesting and to match different sensory needs.,
Task 'Brain Dumping' (Pre-Sleep),45935,Cognitive Management/Sleep Aid,"Writing down all outstanding thoughts, worries, or to-dos before bed to clear the mind and aid sleep.","Before trying to sleep, take 5-10 minutes to write down everything on your mind, clearing your mental slate for rest.",
The 'Mini-Victory' Celebration,1,Motivation/Self-Compassion,Acknowledging and celebrating even the smallest completed tasks to build momentum and positive reinforcement.,"After finishing a dreaded chore or a tiny step of a big project, take a moment to internally or externally acknowledge your achievement (""Yay, I did it!"").",
Sensory-Seeking Food Textures,Variable,Sensory Regulation/Calming,"Using specific food textures (e.g., crunchy, chewy, smooth) as a way to self-regulate and manage oral sensory needs.","Keep a stash of preferred textured foods like crunchy carrots, chewy dried fruit, or smooth purees for sensory input.",
"The 'One In, One Out' Declutter",1,Organization/Executive Function,"A simple rule for preventing clutter accumulation: when a new item comes in, one old, similar item must go out.","When you buy a new shirt, donate or discard an old one. When you get a new book, give one away.",
Scheduled 'Rabbit Holes',Variable,Productivity/Leveraging Strengths,"Deliberately blocking out time for deep dives into special interests or highly engaging topics, as a reward or focus method.","Instead of fighting a ""rabbit hole"" urge, schedule a specific time for it. ""After I finish X, I can research Y for 30 minutes.""",
The 'Social Battery' Visual,1,Social Energy Management,Using a mental (or even physical) battery metaphor to track and communicate social energy levels.,"Mentally check your ""social battery"" throughout the day. If it's low, communicate to others, ""My battery is running low,"" to set boundaries.",
Movement for Focus,Variable,Focus/Physical Regulation,"Incorporating specific, often subtle, movements to aid concentration and manage restlessness.","While working, try bouncing your leg, gently rocking, or pacing during phone calls if it helps you focus without disrupting others.",
The 'Sensory Audit' of Spaces,10-20,Environmental Accommodation/Proactive,Systematically assessing different rooms or environments for their sensory impact and identifying areas for modification.,"Walk through your home or office: ""Is this light too harsh? Is that hum distracting? Where is my calmest spot?""",
Pre-Written Scripts (for difficult calls),45935,Communication/Anxiety Mgmt,"Having short, prepared notes or scripts for anticipated challenging phone calls or interactions.","Before making a customer service call or a difficult personal call, jot down key points, questions, and desired outcomes to stay on track.",
The 'Transition Playlist',Variable,Transitions/Emotional Regulation,Creating a specific music playlist to help signal and facilitate transitions between different activities or moods.,"Have a ""wake up"" playlist, a ""work focus"" playlist, a ""wind down"" playlist, or a ""pump-up"" playlist for specific transitions.",
Visual 'No-Go' Zones,Variable,Sensory Regulation/Boundaries,"Designating specific areas or situations as visually ""off-limits"" when sensory overload is a risk.","Avoid looking directly into bright lights. Use a screen filter. If a cluttered area triggers overwhelm, physically turn away or put up a visual barrier.",
Hyper-fixation as Research Tool,Variable,Learning/Productivity,"Leaning into periods of intense, obsessive focus on a topic as a powerful learning or problem-solving method.","When you feel a hyper-fixation starting on a relevant topic, allow yourself to dive deep, collecting information and making connections quickly.",
The 'Everything Drawer/Box',1,Organization/Executive Function,"Having one designated, often messy, drawer or box for miscellaneous items that don't have a clear home.","Instead of scattering small items, create one specific ""everything drawer"" where things go when you don't have the energy to put them away properly.",
Sensory-Specific Personal Care,Variable,Routine/Sensory Comfort,"Choosing personal care products based on their specific sensory qualities (scent, texture, temperature).","Use a body wash with a scent you love, a toothpaste with a non-overwhelming flavor, or a hairbrush with bristles that feel good on your scalp.",
The 'Future Self' Motivation,1,Motivation/Executive Function,"Framing tasks as acts of kindness or support for your future self, making them less daunting.","Future me will be so grateful if current me just loads the dishwasher now. ""I'm setting up future me for success by doing this task.""",
Pattern Recognition for Triggers,45935,Self-Understanding/Emotional Reg.,Actively looking for recurring patterns or preceding events that lead to specific emotional states or overwhelm.,"Keep a simple log: ""What happened just before I felt overwhelmed? What was I doing/experiencing before I got frustrated?""",
The 'Sensory Friendly' Meetup,Variable,Social Accommodation/Boundaries,Suggesting or organizing social gatherings in environments known to be less sensually overwhelming.,"Suggest meeting at a quiet cafe during off-peak hours, going for a walk, or having a virtual chat instead of a loud restaurant or bar.",
Micro-Movement Breaks (Subtle),Variable,Focus/Physical Regulation,"Incorporating very small, discreet movements into static situations to help maintain focus or release restlessness.","Wiggle your toes inside your shoes, gently rock in your chair, or tap your fingers subtly under the desk during meetings or lectures.",
The 'Just 5 Minutes' Jumpstart,5,Task Initiation/Overwhelm Reduction,"Committing to only 5 minutes of a dreaded task, with the full permission to stop when the time is up.","Set a timer for 5 minutes and tell yourself, ""I only have to do this for 5 minutes."" Often, once started, you'll continue beyond 5 minutes.",
"The ""Sensory Check-Out"" Routine",10-30,Decompression/Sensory Regulation,A deliberate sequence of actions to systematically reduce sensory input after a stimulating environment.,"After a busy day, dim lights, put on noise-canceling headphones, change into comfort clothes, and engage in a calming sensory activity.",
Interest-Based Scheduling,Variable,Productivity/Motivation,"Structuring your day or week around periods of high interest or motivation, rather than strict time blocks.","Identify when you feel naturally drawn to certain tasks (e.g., coding late at night, creative work in the morning) and schedule them then.",
Visual Task Completion,1,Motivation/Executive Function,"Using physical or digital visual cues to mark off completed tasks, providing a satisfying sense of accomplishment.","Use a whiteboard, a large planner, or a digital checklist app where you can physically tick, cross out, or move tasks to a ""done"" column.",
The 'Safe Food' Stash,Variable,Executive Function/Sensory Comfort,"Keeping a reliable supply of a few specific foods that are always palatable and sensory-safe, especially for low-energy days.","Stock your pantry with a few go-to ""safe foods"" that you know you can always eat, even when overstimulated or executive function is low.",
The 'Sensory Friendly' Playlist,Variable,Focus/Sensory Regulation,"Curating a music playlist specifically designed to aid focus, calm, or energize without being distracting.","Create playlists with instrumental music, specific genres (e.g., lo-fi, classical), or natural sounds that help you concentrate or relax without demanding attention.",
Planned 'Info Dumps' (To Self),10-15,Cognitive Management/Overwhelm,"Scheduling dedicated time to freely write or speak all thoughts and information swirling in your mind, for release and organization.","Set a timer for 10-15 minutes and just dump all thoughts, ideas, and worries onto paper or into a voice recording, without judgment or pressure to act.",
The 'Body Doubling' App/Community,Variable,Productivity/Accountability,Utilizing online platforms or apps that connect you with others working in parallel for shared focus and accountability.,"Join a virtual ""body doubling"" session or use an app that provides a quiet, shared virtual workspace to help stay on task.",
The 'No' Script Practice,45689,Boundaries/Communication,"Rehearsing simple, clear ways to say ""no"" or set limits without over-explaining or feeling guilty.","Practice phrases like ""That doesn't work for me,"" ""I have a prior commitment,"" or ""I need to prioritize my energy right now"" in front of a mirror.",
Sensory Calming Scents,45778,Sensory Regulation/Emotional,Using specific essential oils or other scents known to promote calmness and reduce anxiety.,"Keep a rollerball with lavender oil, a calming room spray, or a scented candle nearby to use when feeling overwhelmed or needing to relax.",
Micro-Breaks for Special Interest,45689,Motivation/Focus,Integrating very short bursts of special interest engagement into work or study periods as quick motivators.,"After completing a small task, allow yourself 1-2 minutes to look at a favorite image related to your special interest, read a fun fact, or watch a short clip.",
The 'Brain to Whiteboard' Dump,45935,Organization/Executive Function,"Using a large whiteboard to visually map out thoughts, tasks, or project components, leveraging visual processing.","Dedicate a section of a whiteboard to ""ideas,"" ""to-do,"" ""currently working on,"" and move things around as you process them.",
The 'Sensory Bag' for Outings,45778,Proactive Regulation/Portability,Assembling a small bag with essential sensory regulation tools to take with you when leaving the house.,"Pack earplugs/headphones, a favorite fidget, a calming scent, and perhaps a small, comforting snack or drink for public outings.",
Scheduled 'Unmasking' Time,Variable,Energy Management/Well-being,Deliberately blocking out time in your day or week where you consciously allow yourself to drop any social masking.,"Schedule specific periods (e.g., an hour after work, Saturday mornings) where you can be fully yourself, without performing or conforming.",
The 'Future Me' Task List,45689,Executive Function/Motivation,"Creating lists or reminders specifically for your future self, as if you're helping a different person.","Write a note: ""Hey future me, remember to pack your lunch for tomorrow!"" or ""Future me will thank current me for tidying this up now.""",
Comfort Texture Items,Variable,Sensory Regulation/Calming,Keeping specific items with satisfying textures readily available for tactile self-soothing.,"Have a smooth stone, a velvet cloth, a squishy stress ball, or a plush toy that you can touch and manipulate for comfort.",
The 'One Thing Started' Rule,1,Task Initiation/Overwhelm Reduction,"When completely stuck, commit to just starting the absolute first step of a task, even if it's just opening a document.","Don't aim to complete the task; just aim to initiate it. Opening the document, turning on the computer, or getting the cleaning supplies out counts.",
Body Language 'Reads' (for self),45689,Self-Awareness/Emotional Reg.,Paying attention to your own physical sensations and body language as early warning signs of stress or overwhelm.,"Notice tension in your shoulders, fidgeting, or shallow breathing. Use these physical cues as a signal to engage a self-regulation hack.",
Visual Countdown Timers (Large),Variable,Time Management/Transitions,"Using large, clear visual timers (like kitchen timers or apps with big numbers) to manage time blindness and transitions.","Place a large timer in a visible spot. Set it for specific work blocks, breaks, or to signal when it's time to switch tasks or leave.",
Auditory Calming Environment,Variable,Sensory Regulation/Environment,Creating an auditory environment that promotes calm through chosen sounds or minimal sound.,"Use noise-canceling headphones, play white/brown/pink noise, or listen to soft, consistent ambient sounds (e.g., gentle rain, distant ocean waves).",
The 'Just for Today' Mindset,1,Overwhelm Reduction/Self-Compassion,"Focusing only on what needs to be done today, letting go of the burden of future tasks or past failures.","When feeling overwhelmed by a large workload or long-term goals, tell yourself, ""I only need to focus on what's actionable just for today.""",
"The ""Weighted Plushie/Stuffed Animal""",Variable,Sensory Regulation/Emotional,Using a weighted plush toy or stuffed animal for comforting deep pressure input and emotional support.,"Keep a weighted stuffed animal nearby to hold, place on your lap, or cuddle with when feeling anxious, overwhelmed, or needing comfort.",
Sensory-Safe Lighting,Variable,Environmental Accommodation,"Modifying lighting to reduce harshness or overstimulation, using warm tones or indirect light.","Use dimmers, warm-toned light bulbs (e.g., smart bulbs that change color), lamps instead of overhead lights, or string lights for softer illumination.",
The 'Done for the Day' Signal,1,Boundaries/Energy Management,"Creating a specific, ritualistic action to signal the end of the workday or a demanding task, promoting mental disengagement.","At the end of work, close a specific application, put away a certain item, or say ""Done for the day!"" out loud to transition out of work mode.",
